{
  "schema_version": "1.0",
  "generated_at": "2026-08-07T01:43:35.0796232Z",
  "machine": {
    "machine_identifier_exported": false,
    "username_exported": false,
    "os": "Windows",
    "architecture": "x64"
  },
  "security": {
    "secrets_exported": false,
    "credential_stores_scanned": false,
    "browser_sessions_scanned": false,
    "environment_values_exported": false
  },
  "summary": {
    "mcp_servers": 8,
    "cli_tools": 8,
    "external_services": 2,
    "codex_skills": 37,
    "login_required": 3,
    "manual_restore_required": 55
  },
  "items": [
    {
      "id": "mcp:openaiDeveloperDocs",
      "name": "openaiDeveloperDocs",
      "category": "mcp_server",
      "current_status": "configured_not_installed",
      "discovery": {
        "source": "codex_config",
        "historical": false,
        "confidence": "confirmed"
      },
      "installation": {
        "status": "not_installed",
        "executable_found": false,
        "version": ""
      },
      "configuration": {
        "present": true,
        "enabled": true,
        "transport": "stdio",
        "command_template": "",
        "args": null,
        "contains_machine_specific_path": false,
        "environment_variables": []
      },
      "authentication": {
        "required": false,
        "status": "not_required",
        "secret_exported": false
      },
      "verification": {
        "Startup": "not_run",
        "McpInitialize": "not_run",
        "ToolsList": "not_run",
        "VerifiedAt": null
      },
      "restore": {
        "automatic_safe": false,
        "steps": [
          "在目標電腦安裝或確認 MCP 執行檔",
          "依 command_template 重新建立 Codex MCP 設定",
          "重新啟動 Codex",
          "執行 codex mcp get ",
          "openaiDeveloperDocs",
          "依 verification 欄位重新驗證 initialize 與 tools/list"
        ]
      },
      "notes": [
        "不會同步 env 值、登入狀態或本機絕對路徑。"
      ]
    },
    {
      "id": "mcp:context7",
      "name": "context7",
      "category": "mcp_server",
      "current_status": "ready",
      "discovery": {
        "source": "codex_config",
        "historical": false,
        "confidence": "confirmed"
      },
      "installation": {
        "status": "installed",
        "executable_found": true,
        "version": ""
      },
      "configuration": {
        "present": true,
        "enabled": true,
        "transport": "stdio",
        "command_template": "npx",
        "args": [
          "-y",
          "@upstash/context7-mcp"
        ],
        "contains_machine_specific_path": false,
        "environment_variables": []
      },
      "authentication": {
        "required": false,
        "status": "not_required",
        "secret_exported": false
      },
      "verification": {
        "Startup": "not_run",
        "McpInitialize": "not_run",
        "ToolsList": "not_run",
        "VerifiedAt": null
      },
      "restore": {
        "automatic_safe": false,
        "steps": [
          "在目標電腦安裝或確認 MCP 執行檔",
          "依 command_template 重新建立 Codex MCP 設定",
          "重新啟動 Codex",
          "執行 codex mcp get ",
          "context7",
          "依 verification 欄位重新驗證 initialize 與 tools/list"
        ]
      },
      "notes": [
        "不會同步 env 值、登入狀態或本機絕對路徑。"
      ]
    },
    {
      "id": "mcp:node_repl",
      "name": "node_repl",
      "category": "mcp_server",
      "current_status": "ready",
      "discovery": {
        "source": "codex_config",
        "historical": false,
        "confidence": "confirmed"
      },
      "installation": {
        "status": "installed",
        "executable_found": true,
        "version": ""
      },
      "configuration": {
        "present": true,
        "enabled": true,
        "transport": "stdio",
        "command_template": "%USERPROFILE%\\AppData\\Local\\OpenAI\\Codex\\runtimes\\cua_node\\f8d2abcb7481383b\\bin\\node_repl.exe",
        "args": null,
        "contains_machine_specific_path": true,
        "environment_variables": [
          {
            "name": "BROWSER_USE_AVAILABLE_BACKENDS",
            "configured": true,
            "value_exported": false
          },
          {
            "name": "BROWSER_USE_CODEX_APP_BUILD_FLAVOR",
            "configured": true,
            "value_exported": false
          },
          {
            "name": "BROWSER_USE_CODEX_APP_VERSION",
            "configured": true,
            "value_exported": false
          },
          {
            "name": "CODEX_CLI_PATH",
            "configured": true,
            "value_exported": false
          },
          {
            "name": "CODEX_HOME",
            "configured": true,
            "value_exported": false
          },
          {
            "name": "NODE_REPL_INSTRUCTIONS_USE_CASE_BROWSER",
            "configured": true,
            "value_exported": false
          },
          {
            "name": "NODE_REPL_INSTRUCTIONS_USE_CASE_CHROME",
            "configured": true,
            "value_exported": false
          },
          {
            "name": "NODE_REPL_NATIVE_PIPE_CONNECT_TIMEOUT_MS",
            "configured": true,
            "value_exported": false
          },
          {
            "name": "NODE_REPL_NODE_MODULE_DIRS",
            "configured": true,
            "value_exported": false
          },
          {
            "name": "NODE_REPL_NODE_PATH",
            "configured": true,
            "value_exported": false
          },
          {
            "name": "NODE_REPL_TRUSTED_BROWSER_CLIENT_SHA256S",
            "configured": true,
            "value_exported": false
          },
          {
            "name": "NODE_REPL_TRUSTED_CODE_PATHS",
            "configured": true,
            "value_exported": false
          },
          {
            "name": "SKY_CUA_NATIVE_PIPE",
            "configured": true,
            "value_exported": false
          },
          {
            "name": "SKY_CUA_NATIVE_PIPE_DIRECTORY",
            "configured": true,
            "value_exported": false
          }
        ]
      },
      "authentication": {
        "required": true,
        "status": "manual_verification_required",
        "secret_exported": false
      },
      "verification": {
        "Startup": "not_run",
        "McpInitialize": "not_run",
        "ToolsList": "not_run",
        "VerifiedAt": null
      },
      "restore": {
        "automatic_safe": false,
        "steps": [
          "在目標電腦安裝或確認 MCP 執行檔",
          "依 command_template 重新建立 Codex MCP 設定",
          "重新啟動 Codex",
          "執行 codex mcp get ",
          "node_repl",
          "依 verification 欄位重新驗證 initialize 與 tools/list"
        ]
      },
      "notes": [
        "不會同步 env 值、登入狀態或本機絕對路徑。"
      ]
    },
    {
      "id": "mcp:headroom",
      "name": "headroom",
      "category": "mcp_server",
      "current_status": "ready",
      "discovery": {
        "source": "codex_config",
        "historical": false,
        "confidence": "confirmed"
      },
      "installation": {
        "status": "installed",
        "executable_found": true,
        "version": ""
      },
      "configuration": {
        "present": true,
        "enabled": true,
        "transport": "stdio",
        "command_template": "%USERPROFILE%\\.codex\\tools\\headroom-venv\\Scripts\\headroom.exe",
        "args": [
          "mcp",
          "serve"
        ],
        "contains_machine_specific_path": true,
        "environment_variables": [
          {
            "name": "HEADROOM_TELEMETRY",
            "configured": true,
            "value_exported": false
          }
        ]
      },
      "authentication": {
        "required": true,
        "status": "manual_verification_required",
        "secret_exported": false
      },
      "verification": {
        "Startup": "not_run",
        "McpInitialize": "not_run",
        "ToolsList": "not_run",
        "VerifiedAt": null
      },
      "restore": {
        "automatic_safe": false,
        "steps": [
          "在目標電腦安裝或確認 MCP 執行檔",
          "依 command_template 重新建立 Codex MCP 設定",
          "重新啟動 Codex",
          "執行 codex mcp get ",
          "headroom",
          "依 verification 欄位重新驗證 initialize 與 tools/list"
        ]
      },
      "notes": [
        "不會同步 env 值、登入狀態或本機絕對路徑。"
      ]
    },
    {
      "id": "mcp:notion",
      "name": "notion",
      "category": "mcp_server",
      "current_status": "configured_not_installed",
      "discovery": {
        "source": "codex_config",
        "historical": false,
        "confidence": "confirmed"
      },
      "installation": {
        "status": "not_installed",
        "executable_found": false,
        "version": ""
      },
      "configuration": {
        "present": true,
        "enabled": true,
        "transport": "stdio",
        "command_template": "",
        "args": null,
        "contains_machine_specific_path": false,
        "environment_variables": []
      },
      "authentication": {
        "required": false,
        "status": "not_required",
        "secret_exported": false
      },
      "verification": {
        "Startup": "not_run",
        "McpInitialize": "not_run",
        "ToolsList": "not_run",
        "VerifiedAt": null
      },
      "restore": {
        "automatic_safe": false,
        "steps": [
          "在目標電腦安裝或確認 MCP 執行檔",
          "依 command_template 重新建立 Codex MCP 設定",
          "重新啟動 Codex",
          "執行 codex mcp get ",
          "notion",
          "依 verification 欄位重新驗證 initialize 與 tools/list"
        ]
      },
      "notes": [
        "不會同步 env 值、登入狀態或本機絕對路徑。"
      ]
    },
    {
      "id": "mcp:agent_bridge",
      "name": "agent_bridge",
      "category": "mcp_server",
      "current_status": "ready",
      "discovery": {
        "source": "codex_config",
        "historical": false,
        "confidence": "confirmed"
      },
      "installation": {
        "status": "installed",
        "executable_found": true,
        "version": ""
      },
      "configuration": {
        "present": true,